{
  "issue_date": "2026-09-17",
  "period": {
    "from": "2026-09-14",
    "to": "2026-09-17"
  },
  "sources_reviewed": [
    {
      "name": "Sponichi",
      "status": "ok",
      "articles_used": 4
    },
    {
      "name": "Hochi News",
      "status": "ok",
      "articles_used": 4
    },
    {
      "name": "Nikkan Sports",
      "status": "ok",
      "articles_used": 1
    },
    {
      "name": "Sanspo",
      "status": "ok",
      "articles_used": 1
    },
    {
      "name": "Sumo Stomp!",
      "status": "ok",
      "articles_used": 4
    },
    {
      "name": "NHK",
      "status": "ok",
      "articles_used": 1
    },
    {
      "name": "Sankei",
      "status": "ok",
      "articles_used": 0
    },
    {
      "name": "dメニュー",
      "status": "ok",
      "articles_used": 1
    },
    {
      "name": "Chunichi Sports",
      "status": "ok",
      "articles_used": 1
    },
    {
      "name": "Kyodo News",
      "status": "ok",
      "articles_used": 1
    }
  ],
  "lead": "Первая пятидневка Аки Басё прошла без устойчивого лидера: на четвёртый день 36-летний Такаясу снял ёкодзуну Оносато и взял кинбоши, а единственный шедший без поражений Котодзакура на пятый день уступил Чураноуми — борцов с чистым счётом в макуути не осталось. Аонишики проиграл два дня подряд и идёт с 3-2, Оносато, Киришима, Атамифуджи, Чураноуми и Ура — с одним поражением. В дзюрё пять побед из пяти у Кагаяки — впервые с Хацу Басё 2020 года.",
  "blocks": [
    {
      "date": "2026-09-16",
      "place": "Токио, Рёгоку Кокугикан, заключительная схватка четвёртого дня",
      "subtitle": "Такаясу снял Оносато и взял седьмой кинбоши",
      "body": "Главная схватка периода — заключительная на четвёртый день: 36-летний маегашира Такаясу (高安) мощным качиаге [удар предплечьем снизу] отбросил ёкодзуну Оносато (大の里), пошёл вперёд и добил его у края, когда тот по привычке потянул на себя. Приём источники называют по-разному: Sponichi — цукитаоши, Sumo Stomp — цукиотоши. По японской версии Такаясу забрал 61 конверт кеншо и седьмой в карьере кинбоши [победа маегаширы над ёкодзуной], третий после падения с озеки в 2020 году: это повтор рекорда среди бывших озеки (Миненояма, 三根山, и Котошогику, 琴奨菊) и девятый по возрасту кинбоши со времён Шова — 36 лет и 6 месяцев. Главный судья Оноэ (尾上, бывший комусуби Хаманошима, 浜ノ嶋) сказал, что ёкодзуна ударил неплохо, но столкновение выиграл Такаясу, а Майноуми Шухей (舞の海秀平, бывший комусуби) в радиоэфире NHK отметил: Оносато вышел на басё, так и не решив, как ему бороться, и на четвёртый день старая привычка снова вылезла. Схватка прервала серию из шести поражений Такаясу от Оносато и вывела ветерана в число тех, кто влияет на борьбу за Кубок.",
      "category": "basho_bout",
      "importance": 5,
      "needs_verification": true,
      "source_ids": [
        "a055",
        "a005",
        "a004",
        "a036",
        "a020"
      ],
      "sources": [
        {
          "name": "Sponichi",
          "url": "https://www.sponichi.co.jp/sports/news/2026/09/17/kiji/20260916s00005000396000c.html"
        },
        {
          "name": "Sumo Stomp!",
          "url": "https://www.sumo-stomp.com/p/2026-aki-basho-day-4-results-and"
        },
        {
          "name": "Sanspo",
          "url": "https://www.sanspo.com/article/20260917-CY73GXL5UZHZ5B4AWEFHBLXZ6E/"
        },
        {
          "name": "dメニュー",
          "url": "https://topics.smt.docomo.ne.jp/article/sanspo/sports/sanspo-_sports_sumo_CY73GXL5UZHZ5B4AWEFHBLXZ6E"
        },
        {
          "name": "NHK",
          "url": "https://news.web.nhk/newsweb/na/nd-20260916de50680"
        }
      ]
    },
    {
      "date": "2026-09-16",
      "place": "Токио, Рёгоку Кокугикан",
      "subtitle": "День 4: первые поражения Оносато и Аонишики, Котодзакура — единоличный лидер",
      "body": "Четвёртый день разом убрал с чистого счёта почти всю верхушку: ёкодзуна Оносато (大の里) впервые проиграл — маегашире Такаясу (高安), а озеки Аонишики (安青錦) впервые за семь встреч уступил новому комусуби Хакунофуджи (伯乃富士). Единоличным лидером с 4-0 остался Котодзакура (琴桜), бросивший Гонояму (豪ノ山) уватенаге [броском через руку]; по данным Kyodo News, вместе с Аонишики после четырёх дней с 3-1 шли шестнадцать борцов макуути. Sumo Stomp при замедленном просмотре утверждает, что незадолго до вылета Аонишики сам Хакунофуджи протащил по глине тыльную сторону ступни, что считается касанием, но моно-ии [совещание судей] не назначили; в других источниках корпуса этого наблюдения нет. Киришима (霧島) после поражения днём ранее взял моро-дзаши [двойной внутренний захват] и вывел Котоэйхо (romaji: Kotoeiho — требует проверки), для которого 1-3 — худший старт в макуути.",
      "category": "basho_day",
      "importance": 4,
      "needs_verification": true,
      "source_ids": [
        "a005",
        "a052"
      ],
      "sources": [
        {
          "name": "Sumo Stomp!",
          "url": "https://www.sumo-stomp.com/p/2026-aki-basho-day-4-results-and"
        },
        {
          "name": "Kyodo News",
          "url": "https://english.kyodonews.net/articles/-/85216"
        }
      ]
    },
    {
      "date": "2026-09-17",
      "place": "Токио, Рёгоку Кокугикан",
      "subtitle": "Чураноуми остановил Котодзакуру: в макуути не осталось борцов без поражений",
      "body": "На пятый день Чураноуми (美ノ海) низким и резким тачиай встретил Котодзакуру (琴桜), пошёл вперёд и вытолкнул его ошидаши [выталкивание толчками] — чистого счёта в макуути больше нет ни у кого. 33-летний борец из Кисе-бея (木瀬) с 4-1 вышел в группу лидеров и второй басё подряд обыгрывает этого озеки; в прошлом турнире с личного максимума, маегашира №2, он закончил 7-8, а к Кюшу Басё, домашнему для него как уроженца Окинавы, рассчитывает впервые попасть в санъяку [комусуби и выше]. Оносато (大の里) избежал двух поражений подряд: взял нижний захват правой и вытеснил Ёшинофуджи (義ノ富士) ёрикири [выталкивание в захвате]. Sponichi пишет, что до этого ёкодзуна проигрывал Ёшинофуджи все четыре встречи, включая одну неявкой, тогда как Sumo Stomp перед схваткой описывал серию как 3-0 в пользу маегаширы — расхождение в счёте личных встреч. С одним поражением идёт и 34-летний Ура (宇良), поймавший Вакамотохару (若元春) сотогаке [внешний зацеп]; оякату Минатогава (湊川, бывший озеки Такакейшо, 貴景勝) в эфире NHK похвалил его за низкую стойку и объём тренировок в 34 года.",
      "category": "makuuchi_juryo",
      "importance": 4,
      "needs_verification": true,
      "source_ids": [
        "a001",
        "a002",
        "a037"
      ],
      "sources": [
        {
          "name": "Sponichi",
          "url": "https://www.sponichi.co.jp/sports/news/2026/09/17/kiji/20260917s00005000281000c.html"
        },
        {
          "name": "Hochi News",
          "url": "https://hochi.news/articles/20260917-OHT1T51281.html"
        },
        {
          "name": "Chunichi Sports",
          "url": "https://www.chunichi.co.jp/article/1312608"
        }
      ]
    },
    {
      "date": "2026-09-17",
      "place": "Токио, Рёгоку Кокугикан",
      "subtitle": "Аонишики проиграл второй день подряд",
      "body": "Озеки Аонишики (安青錦, 22 года, Анджигава-бея, 安治川) уступил Гонояме (豪ノ山, 28 лет, Такекума-бея, 武隈): тот с тачиай прижал его к краю и уложил ошитаоши [толчок вниз с падением], счёт стал 3-2 после двух поражений подряд. Ояката Минатогава (湊川, бывший озеки Такакейшо, 貴景勝) в комментарии для NHK отметил, что Аонишики второй день ломают уже на столкновении: «возможно, он дал соперникам материал для изучения», а план Гоноямы состоял в том, чтобы идти напролом и смириться, если соперник уйдёт в сторону — то есть сознательно принять риск хенки [уход в сторону на столкновении]. Сам Аонишики сказал, что будет набирать форму по ходу турнира. Для озеки, который начал басё с двух уверенных побед, две потери в первую пятидневку — ощутимая потеря позиции в борьбе за Кубок.",
      "category": "makuuchi_juryo",
      "importance": 4,
      "source_ids": [
        "a001",
        "a003"
      ],
      "sources": [
        {
          "name": "Sponichi",
          "url": "https://www.sponichi.co.jp/sports/news/2026/09/17/kiji/20260917s00005000281000c.html"
        },
        {
          "name": "Nikkan Sports",
          "url": "https://www.nikkansports.com/battle/sumo/news/202609170001253.html"
        }
      ]
    },
    {
      "date": "2026-09-17",
      "place": "Токио, Рёгоку Кокугикан",
      "subtitle": "Атамифуджи закончил первую пятидневку с 4-1 в заходе на озеки",
      "body": "Секиваке Атамифуджи (熱海富士, 24 года, Исегахама-бея, 伊勢ケ浜) не дрогнул под толчками комусуби Дайейшо (大栄翔, 32 года, Оитекадзе-бея, 追手風) и спокойно вытолкнул его, завершив первые пять дней с 4-1. Заход на озеки у него живой: после 9 побед на Нацу Басё и 12 на Нагоя Басё до ориентира в 33 победы за три турнира ему нужно 12 в этом, то есть 12-3 или лучше. Единственное поражение он получил на третий день от неудобного Таканошо (隆の勝), но на следующий день выиграл первую в карьере встречу с одногодкой Фуджирёгой (藤凌駕) и серии не допустил. Рядом идёт Киришима (霧島), у которого на кону заход на ёкодзунское звание: он отправил Таканошо окуридаши [выталкивание со спины] и держится с одним поражением.",
      "category": "makuuchi_juryo",
      "importance": 4,
      "source_ids": [
        "a053",
        "a001"
      ],
      "sources": [
        {
          "name": "Sponichi",
          "url": "https://www.sponichi.co.jp/sports/news/2026/09/17/kiji/20260917s00005000200000c.html"
        },
        {
          "name": "Sponichi",
          "url": "https://www.sponichi.co.jp/sports/news/2026/09/17/kiji/20260917s00005000281000c.html"
        }
      ]
    },
    {
      "date": "2026-09-13",
      "place": "Токио, Рёгоку Кокугикан",
      "subtitle": "День 1: Оносато остался единственным ёкодзуной на дохё, все озеки выиграли",